{
  "version": "0.1.0",
  "title": "STAMPED research-object rubric",
  "description": "A manuscript-derived pilot rubric for describing STAMPED fulfillment in a research object. Scores summarize this perspective under declared weights; they are not general research-quality judgments or validated measurements.",
  "source": {
    "repository": "https://github.com/stamped-principles/stamped-paper",
    "revision": "5bbb3ed471a5e9bf8c8e91cdef6b96686c4c53ea",
    "path": "main.tex",
    "status": "provisional"
  },
  "dimensions": [
    {
      "id": "S",
      "label": "Self-containment",
      "description": "Everything needed is reachable from the research object."
    },
    {
      "id": "T",
      "label": "Tracking",
      "description": "Component states and the history of their transformations are recorded."
    },
    {
      "id": "A",
      "label": "Actionability",
      "description": "Instructions and executable procedures make the object usable."
    },
    {
      "id": "M",
      "label": "Modularity",
      "description": "Components have separable, composable boundaries."
    },
    {
      "id": "P",
      "label": "Portability",
      "description": "Explicit specifications avoid dependence on undocumented host state."
    },
    {
      "id": "E",
      "label": "Ephemerality",
      "description": "Computations use fresh, disposable environments."
    },
    {
      "id": "D",
      "label": "Distributability",
      "description": "Others can obtain the intended state persistently."
    }
  ],
  "principles": [
    {
      "code": "S.1",
      "dimension": "S",
      "level": "must",
      "statement": "All modules and components essential to replicate computational execution MUST be reachable within a single top-level research object."
    },
    {
      "code": "S.2",
      "dimension": "S",
      "level": "must",
      "statement": "License declarations for all components are themselves part of the research object and MUST be retrievable alongside the content they govern."
    },
    {
      "code": "T.1",
      "dimension": "T",
      "level": "must",
      "statement": "Persistent content identification MUST be recorded for all components."
    },
    {
      "code": "T.2",
      "dimension": "T",
      "level": "should",
      "statement": "All components SHOULD be tracked using the same content-addressed version control system."
    },
    {
      "code": "T.3",
      "dimension": "T",
      "level": "must",
      "statement": "Provenance of all modifications MUST be recorded."
    },
    {
      "code": "T.4",
      "dimension": "T",
      "level": "should",
      "statement": "Code-driven provenance SHOULD be recorded programmatically."
    },
    {
      "code": "T.5",
      "dimension": "T",
      "level": "must",
      "statement": "Provenance records MUST include the versions of all components involved."
    },
    {
      "code": "A.1",
      "dimension": "A",
      "level": "must",
      "statement": "Research object MUST contain sufficient instructions to reproduce all computational results."
    },
    {
      "code": "A.2",
      "dimension": "A",
      "level": "should",
      "statement": "Procedures SHOULD be expressed as executable specifications."
    },
    {
      "code": "M.1",
      "dimension": "M",
      "level": "should",
      "statement": "Components SHOULD be organized in a modular structure."
    },
    {
      "code": "M.2",
      "dimension": "M",
      "level": "may",
      "statement": "Components MAY be included directly or linked as subdatasets."
    },
    {
      "code": "M.3",
      "dimension": "M",
      "level": "should",
      "statement": "Each module's license SHOULD be declared independently and checked for compatibility at the boundaries where modules are combined."
    },
    {
      "code": "M.4",
      "dimension": "M",
      "level": "should",
      "statement": "Components governed by different access requirements SHOULD be isolated in separate modules where practical."
    },
    {
      "code": "P.1",
      "dimension": "P",
      "level": "must",
      "statement": "Procedures MUST NOT depend on any undocumented host environment state."
    },
    {
      "code": "P.2",
      "dimension": "P",
      "level": "must",
      "statement": "Computational environments MUST be explicitly specified."
    },
    {
      "code": "P.3",
      "dimension": "P",
      "level": "must",
      "statement": "Environment definitions MUST be version controlled."
    },
    {
      "code": "E.1",
      "dimension": "E",
      "level": "should",
      "statement": "Computational results SHOULD be produced in ephemeral environments."
    },
    {
      "code": "D.1",
      "dimension": "D",
      "level": "must",
      "statement": "All referenced modules and components MUST be persistently retrievable by others."
    },
    {
      "code": "D.2",
      "dimension": "D",
      "level": "should",
      "statement": "Environment specifications SHOULD support reproducible builds."
    },
    {
      "code": "D.3",
      "dimension": "D",
      "level": "should",
      "statement": "Each module SHOULD carry an explicit license with a resolvable identifier."
    }
  ],
  "criteria": [
    {
      "id": "S-01",
      "dimension": "S",
      "principles": [
        "S.1"
      ],
      "title": "A discoverable object boundary",
      "question": "Can the starting object lead a recipient to the components within its stated computational scope?",
      "rationale": "Self-containment starts at one root; knowledge obtained independently of that root cannot repair a missing connection.",
      "evidence_guidance": "Inspect the root record, README, manuscript availability statement, manifests and their explicit links. Record the scope and the path followed.",
      "anchors": [
        {
          "value": 0,
          "label": "Not demonstrated",
          "description": "No route from the starting object to its computational components is identified."
        },
        {
          "value": 1,
          "label": "Limited",
          "description": "The starting object names related resources but does not locate the computational components."
        },
        {
          "value": 2,
          "label": "Partial",
          "description": "The root locates components, but at least one essential component or its relationship to the object is left implicit."
        },
        {
          "value": 3,
          "label": "Fulfilled",
          "description": "The root locates all identified essential components and makes their relationship to the stated computation explicit."
        }
      ],
      "source": {
        "section": "Self-containment",
        "locator": "https://github.com/stamped-principles/stamped-paper/blob/5bbb3ed471a5e9bf8c8e91cdef6b96686c4c53ea/main.tex#L136"
      }
    },
    {
      "id": "S-02",
      "dimension": "S",
      "principles": [
        "S.1"
      ],
      "title": "Data and code within the boundary",
      "question": "Are the data and code needed for the scoped computations included or explicitly referenced?",
      "rationale": "A published narrative alone cannot supply absent computational inputs or transformations.",
      "evidence_guidance": "Trace every scoped result to its input data and source code. Direct files and explicit external references are equally acceptable. Retrieval reliability is assessed under D.",
      "anchors": [
        {
          "value": 0,
          "label": "Not demonstrated",
          "description": "Neither required data nor analysis code is included or explicitly referenced."
        },
        {
          "value": 1,
          "label": "Limited",
          "description": "Data or code is included or referenced, but the other category is missing."
        },
        {
          "value": 2,
          "label": "Partial",
          "description": "Both data and code are represented, but identified essential items are missing or implicit."
        },
        {
          "value": 3,
          "label": "Fulfilled",
          "description": "All identified essential data and code are included or explicitly referenced, including any controlled-access inputs."
        }
      ],
      "source": {
        "section": "Self-containment",
        "locator": "https://github.com/stamped-principles/stamped-paper/blob/5bbb3ed471a5e9bf8c8e91cdef6b96686c4c53ea/main.tex#L131"
      }
    },
    {
      "id": "S-03",
      "dimension": "S",
      "principles": [
        "S.1"
      ],
      "title": "Environment and configuration within the boundary",
      "question": "Are required environments, tools, parameters and configuration included or explicitly referenced?",
      "rationale": "The object boundary includes computational ingredients beyond data and source files.",
      "evidence_guidance": "Inspect environment definitions, dependency declarations, command parameters and configuration files. This assesses presence or reference, not version precision or host portability.",
      "anchors": [
        {
          "value": 0,
          "label": "Not demonstrated",
          "description": "No environment or configuration dependencies are included or explicitly referenced."
        },
        {
          "value": 1,
          "label": "Limited",
          "description": "Environment dependencies or computation settings are represented, but the other category is left implicit."
        },
        {
          "value": 2,
          "label": "Partial",
          "description": "Both environment dependencies and settings are represented, but at least one identified essential item is implicit."
        },
        {
          "value": 3,
          "label": "Fulfilled",
          "description": "All identified essential environment dependencies and settings are included or explicitly referenced; intentional defaults are identifiable."
        }
      ],
      "source": {
        "section": "Self-containment",